{
  "$schema": "./schemas/user-profiles.schema.json",
  "version": "1.0.0",
  "description": "用户配置文件定义，支持不同类型用户的工具组合",
  "profiles": {
    "minimalist": {
      "name": "极简配置",
      "description": "最基础的开发工具，适合轻量级使用",
      "categories": [
        "Essential"
      ],
      "excludedTools": [],
      "settings": {
        "autoUpdate": true,
        "verboseOutput": false,
        "confirmInstalls": false
      },
      "estimatedInstallTime": "1-2 分钟",
      "diskSpace": "< 100MB"
    },
    "developer": {
      "name": "开发者配置",
      "description": "完整的现代开发环境，包含版本管理和开发工具",
      "categories": [
        "Essential",
        "Development", 
        "VersionManagers",
        "ModernTools",
        "GitEnhanced",
        "Editors"
      ],
      "excludedTools": [],
      "settings": {
        "autoUpdate": true,
        "verboseOutput": true,
        "confirmInstalls": true
      },
      "estimatedInstallTime": "2-4 分钟",
      "diskSpace": "150-300MB"
    },
    "poweruser": {
      "name": "高级用户配置", 
      "description": "包含所有增强工具的完整配置，适合高级用户和系统管理员",
      "categories": [
        "Essential",
        "Development",
        "VersionManagers", 
        "ModernTools",
        "FileTools",
        "SystemTools",
        "NetworkTools",
        "ProductivityTools",
        "GitEnhanced",
        "Editors"
      ],
      "excludedTools": [],
      "settings": {
        "autoUpdate": true,
        "verboseOutput": true,
        "confirmInstalls": true
      },
      "estimatedInstallTime": "4-6 分钟",
      "diskSpace": "300-500MB"
    },
    "researcher": {
      "name": "研究配置",
      "description": "专注于数据处理和分析的工具集合",
      "categories": [
        "Essential",
        "Development",
        "Optional"
      ],
      "includedTools": [
        "python",
        "nodejs", 
        "jq",
        "hyperfine",
        "tokei"
      ],
      "excludedTools": [
        "shellcheck",
        "prettier"
      ],
      "settings": {
        "autoUpdate": false,
        "verboseOutput": true,
        "confirmInstalls": true
      },
      "estimatedInstallTime": "2-4 分钟",
      "diskSpace": "150-300MB"
    },
    "sysadmin": {
      "name": "系统管理员配置",
      "description": "专注于系统监控和网络工具的配置",
      "categories": [
        "Essential",
        "SystemTools",
        "NetworkTools",
        "ModernTools"
      ],
      "includedTools": [
        "shellcheck"
      ],
      "excludedTools": [
        "nodejs",
        "python"
      ],
      "settings": {
        "autoUpdate": true,
        "verboseOutput": true,
        "confirmInstalls": false
      },
      "estimatedInstallTime": "2-3 分钟",
      "diskSpace": "100-200MB"
    },
    "custom": {
      "name": "自定义配置",
      "description": "用户可自定义的灵活配置模板",
      "categories": [],
      "includedTools": [],
      "excludedTools": [],
      "settings": {
        "autoUpdate": true,
        "verboseOutput": false,
        "confirmInstalls": true
      },
      "note": "此配置需要用户手动指定工具类别或具体工具"
    }
  },
  "defaultProfile": "developer",
  "metadata": {
    "lastModified": "2025-01-06T12:00:00Z",
    "version": "1.0.0",
    "compatibleWith": ["install_apps.ps1 >= 2.0"],
    "author": "Dotfiles Optimization System"
  }
}